Rapid tyrosine phosphorylation of key cellular proteins is a crucial event in the transduction of activation signals to T-lymphocytes.	6	14	AMINO_ACID
Even a moderate increase in the cellular cysteine supply elevates the intracellular glutathione (GSH) and glutathione disulfide (GSSG) levels and potentiates immunological functions of lymphocytes in vitro.	41	49	AMINO_ACID
We have examined the effects of N-acetyl-L-cysteine (NAC), a well-characterized, thiol-containing antioxidant, on agonist-induced monocytic cell adhesion to endothelial cells (EC).	32	51	AMINO_ACID
We have examined the effects of N-acetyl-L-cysteine (NAC), a well-characterized, thiol-containing antioxidant, on agonist-induced monocytic cell adhesion to endothelial cells (EC).	53	56	AMINO_ACID
Ligand-induced tyrosine phosphorylation of the STATs promotes their homodimer and heterodimer formation and subsequent nuclear translocation.	15	23	AMINO_ACID
Activation of cytoplasmic tyrosine kinases is an important aspect of signal transduction mediated by integrins.	26	34	AMINO_ACID
N-acetyl-L-cysteine (NAC) is an antioxidant molecule endowed with immunomodulatory properties.	0	19	AMINO_ACID
N-acetyl-L-cysteine (NAC) is an antioxidant molecule endowed with immunomodulatory properties.	21	24	AMINO_ACID
To investigate the effect of NAC on the induction phase of T cell responses, we analyzed its action on human dendritic cells (DC) derived from adherent PBMC cultured with IL-4 and granulocyte-macrophage CSF.	29	32	AMINO_ACID
Although trials such as CATIE present important opportunities for pharmacogenetics research, the very richness of the clinical data presents challenges for statistical interpretation, and in particular the risk that data mining will lead to false-positive discoveries	156	182	ANALYTICAL_METHOD
In the last, a circRNA/miRNA/mRNA regulatory network was constructed, and potential compounds and drug which may have the function of anti ccRCC were forecasted by taking advantage of CMap and PharmGKB datasets	15	52	ANALYTICAL_METHOD
"009, logistic regression), when comparing \""best\"" and \""worst\"" risk groups"	5	24	ANALYTICAL_METHOD
Results were assessed by Cox model for survival and by logistic regression for response and toxicity	25	34	ANALYTICAL_METHOD
Results were assessed by Cox model for survival and by logistic regression for response and toxicity	55	74	ANALYTICAL_METHOD
Logistic regression was applied to assess CYP2C19 polymorphism as an effect modifier of cyclophosphamide	0	19	ANALYTICAL_METHOD
These models were evaluated within the PLATO software package using pair wise logistic regression models	68	104	ANALYTICAL_METHOD
Conditional logistic regression estimated odds ratios (ORs) and 95% confidence intervals (CIs) associated with regular use of NSAIDs and with relevant polymorphisms on ovarian cancer risk	0	31	ANALYTICAL_METHOD
Multivariable unconditional logistic regression estimated the association of NSAID use across stratum of each genotype	0	47	ANALYTICAL_METHOD
With the wrapper-based feature selection approach, we employed multilayer feedforward neural network (MFNN) and logistic regression as a basis for comparisons	9	40	ANALYTICAL_METHOD
With the wrapper-based feature selection approach, we employed multilayer feedforward neural network (MFNN) and logistic regression as a basis for comparisons	63	100	ANALYTICAL_METHOD
With the wrapper-based feature selection approach, we employed multilayer feedforward neural network (MFNN) and logistic regression as a basis for comparisons	112	131	ANALYTICAL_METHOD
Our data revealed that the MFNN models were superior to the logistic regression model	27	38	ANALYTICAL_METHOD
Our data revealed that the MFNN models were superior to the logistic regression model	60	85	ANALYTICAL_METHOD
Our logistic regression analyses indicated the probability that 76% patients carrying combination of four SNPs will not show favorable response to AAP therapy	4	23	ANALYTICAL_METHOD
A multiple linear regression model revealed that the ABCC3 -211C/T polymorphism was not independently associated with ADP-induced MPA measurements; a multiple logistic regression model revealed that carrying the ABCC3 -211C allele was not associated with the risk of developing an ST event in clopidogrel-treated patients not harbouring CYP2C19*2, *3 and *17 variants	2	28	ANALYTICAL_METHOD
Seven candidate polymorphisms (rs3842 and rs1045642 in ABCB1, rs212091 and rs3743527 in ABCC1, rs3745274 in CYP2B6, rs628031 in SLC22A1 and rs1517618 in SLCO3A1) were evaluated if they were associated with virological failure through logistic regression analysis	234	253	ANALYTICAL_METHOD
Logistic regression including appropriate covariates was performed	0	19	ANALYTICAL_METHOD
1 or less in the univariate analysis were included in a multiple regression analysis (logistic regression for adverse reactions)	56	75	ANALYTICAL_METHOD
1 or less in the univariate analysis were included in a multiple regression analysis (logistic regression for adverse reactions)	86	105	ANALYTICAL_METHOD
6% in the evaluation by means of logistic regression	33	52	ANALYTICAL_METHOD
A multivariate analysis by logistic regression confirmed its significant contribution (p = 0	2	23	ANALYTICAL_METHOD
A multivariate analysis by logistic regression confirmed its significant contribution (p = 0	27	46	ANALYTICAL_METHOD
Multivariate logistic regression revealed that five SNPs (rs11209026 in IL23R, rs10782001 in FBXL19, rs3087243 in CTLA4, rs651630 in SLC12A8 and rs1800453 in TAP1) were associated with paradoxical reactions	0	32	ANALYTICAL_METHOD
Quality control of genome-wide data was performed according to standard criteria and linear/logistic regression models were used as appropriate under an additive hypothesis	85	111	ANALYTICAL_METHOD
Multiple logistic regression and Cox regression analysis were performed to assess the association of these SNPs with the primary endpoint, which was a composite of transient ischemic attack (TIA), stroke, myocardial infarction, or death within 12 months	0	28	ANALYTICAL_METHOD
Multiple logistic regression and Cox regression analysis were performed to assess the association of these SNPs with the primary endpoint, which was a composite of transient ischemic attack (TIA), stroke, myocardial infarction, or death within 12 months	33	47	ANALYTICAL_METHOD
A sensitivity analysis of a secondary composite endpoint of TIA, stroke, or death demonstrated a significant trend in multiple logistic regression analysis of CYP2C19 variants, with lower odds of secondary endpoint in patients carrying at least 1 LOF allele (*2, *3, *8) than in wild-type homozygotes (OR 0	127	146	ANALYTICAL_METHOD
Logistic regression model adjusted for sex, risk and treatment phase revealed that ITPA rs1127354 homozygous mutated patients showed an increased risk of severe GI and NEU	0	19	ANALYTICAL_METHOD
Logistic regression was used to test for association between these polymorphisms and treatment response	0	19	ANALYTICAL_METHOD
Multivariate logistic regression analysis revealed that the ABCB1 3435C>T polymorphism and cisplatin dose were significant predictors of CR	0	32	ANALYTICAL_METHOD
In a binary logistic regression analysis the odds ratio (OR) was 8	5	31	ANALYTICAL_METHOD
Association with toxicities was evaluated retrospectively using logistic regression analysis	64	83	ANALYTICAL_METHOD
A non-conditional logistic regression was used to identify the factors associated with hepatotoxicity	2	37	ANALYTICAL_METHOD
Multivariate logistic regression analysis was used to structure a nomogram	0	32	ANALYTICAL_METHOD
Univariate and multivariate statistical analysis by logistic regression revealed 10 SNPs associated with severe adverse reactions to capecitabine (P<0	52	71	ANALYTICAL_METHOD
The relation of SOCS1-1478 CA/del polymorphism to PCOS status and insulin resistance was analysed via logistic regression analysis	102	121	ANALYTICAL_METHOD
Odds ratios for HLA alleles and KIR types and HLA*KIR interactions using conditional logistic regressions were determined in the overall population and by race/ethnicity	73	105	ANALYTICAL_METHOD
The genetic associations were tested using logistic regression analyses	43	62	ANALYTICAL_METHOD
Logistic regression analysis showed that the dose of metoprolol and the genotypes of <i>CYP2D6</i> were predictors of heart rate\u00a0<70\u00a0beats/min in these patients	0	19	ANALYTICAL_METHOD
Linear regression was performed for baseline weight and BMI <i>z</i>, while change in BMI <i>z</i> was assessed using random effects ordered logistic regression	0	17	ANALYTICAL_METHOD
Linear regression was performed for baseline weight and BMI <i>z</i>, while change in BMI <i>z</i> was assessed using random effects ordered logistic regression	118	161	ANALYTICAL_METHOD
Next, binary logistic regression was applied to evaluate the association of the PGSs to SSRIs treatment response in a discovery sample (ISPC, N\u2009=\u2009865), and in a replication cohort (STAR*D, N\u2009=\u20091,878)	6	32	ANALYTICAL_METHOD
<b>Conclusions:</b> This study did identify associations between <i>CHRM2</i> variations and TD; the results of logistic regression analysis with covariates suggest that the association is, however, likely to be secondary to other concomitant factors	112	131	ANALYTICAL_METHOD
2) and clinical conditions in relation to severe (III-IV) adverse drug reactions (ADRs), stepwise forward multivariate logistic regression analyses were performed	119	138	ANALYTICAL_METHOD
Moreover, the multinomial logistic regression analysis showed that SNP genotypes within the <i>SLC22A1</i>, <i>SLC22A2</i>, and <i>SLC22A3</i> genes, body mass index (BMI) and age of diagnosis were significantly associated with glycemic control (<i>p</i> < 0	26	45	ANALYTICAL_METHOD
Cox proportional hazard and logistic regression were used to estimate risk predictors of toxicity and reduced RDI, respectively	0	23	ANALYTICAL_METHOD
Cox proportional hazard and logistic regression were used to estimate risk predictors of toxicity and reduced RDI, respectively	28	47	ANALYTICAL_METHOD
The three top scoring SNPs (rs12248560, rs878567, rs17710780) were subsequently combined into an unweighted GRS, which was included in linear and logistic regression models using the CES-D score, occurrence of a major depressive episode (MDE) during follow-up and regular antidepressant treatment during the 6 months preceding follow-up assessment as outcomes	146	165	ANALYTICAL_METHOD
Linear and logistic regression analyses were used to assess predictors of withdrawal symptomatology	11	30	ANALYTICAL_METHOD
Logistic regression analysis showed that high SAMe-TT<sub>2</sub>R<sub>2</sub> score was the only statistically significant predicting factor of poor INR control (odds ratio (OR) 5	0	19	ANALYTICAL_METHOD
Cox and logistic regression models with Elastic net penalty were employed	0	3	ANALYTICAL_METHOD
Cox and logistic regression models with Elastic net penalty were employed	8	27	ANALYTICAL_METHOD
In a logistic regression analysis, higher CYP2C19 activity (OR (95% CI): 4	5	24	ANALYTICAL_METHOD
We apply eight machine learning techniques, including naive Bayes classifier (NB), support vector machine (SVM), elastic net regression (ENET), logistic regression (LR), lasso regression (LAR), multivariate adaptive regression splines (MARS), boosted regression tree (BRT) and random forest model (RF)	15	31	ANALYTICAL_METHOD
We apply eight machine learning techniques, including naive Bayes classifier (NB), support vector machine (SVM), elastic net regression (ENET), logistic regression (LR), lasso regression (LAR), multivariate adaptive regression splines (MARS), boosted regression tree (BRT) and random forest model (RF)	54	76	ANALYTICAL_METHOD
We apply eight machine learning techniques, including naive Bayes classifier (NB), support vector machine (SVM), elastic net regression (ENET), logistic regression (LR), lasso regression (LAR), multivariate adaptive regression splines (MARS), boosted regression tree (BRT) and random forest model (RF)	83	105	ANALYTICAL_METHOD
We apply eight machine learning techniques, including naive Bayes classifier (NB), support vector machine (SVM), elastic net regression (ENET), logistic regression (LR), lasso regression (LAR), multivariate adaptive regression splines (MARS), boosted regression tree (BRT) and random forest model (RF)	113	135	ANALYTICAL_METHOD
We apply eight machine learning techniques, including naive Bayes classifier (NB), support vector machine (SVM), elastic net regression (ENET), logistic regression (LR), lasso regression (LAR), multivariate adaptive regression splines (MARS), boosted regression tree (BRT) and random forest model (RF)	144	163	ANALYTICAL_METHOD
We apply eight machine learning techniques, including naive Bayes classifier (NB), support vector machine (SVM), elastic net regression (ENET), logistic regression (LR), lasso regression (LAR), multivariate adaptive regression splines (MARS), boosted regression tree (BRT) and random forest model (RF)	170	186	ANALYTICAL_METHOD
We apply eight machine learning techniques, including naive Bayes classifier (NB), support vector machine (SVM), elastic net regression (ENET), logistic regression (LR), lasso regression (LAR), multivariate adaptive regression splines (MARS), boosted regression tree (BRT) and random forest model (RF)	194	234	ANALYTICAL_METHOD
We apply eight machine learning techniques, including naive Bayes classifier (NB), support vector machine (SVM), elastic net regression (ENET), logistic regression (LR), lasso regression (LAR), multivariate adaptive regression splines (MARS), boosted regression tree (BRT) and random forest model (RF)	243	266	ANALYTICAL_METHOD
We apply eight machine learning techniques, including naive Bayes classifier (NB), support vector machine (SVM), elastic net regression (ENET), logistic regression (LR), lasso regression (LAR), multivariate adaptive regression splines (MARS), boosted regression tree (BRT) and random forest model (RF)	277	296	ANALYTICAL_METHOD
We used a logistic regression model to identify patient variables that predicted successful enrollment after subjects were contacted and evaluated the reasons that clinical trial eligible subjects refused enrollment	9	29	ANALYTICAL_METHOD
Multivariable logistic regression analysis showed the minor alleles of these three SNPs were associated with lower odds for MRONJ	0	33	ANALYTICAL_METHOD
Our data revealed that the ensemble predictive algorithm with feature selection (using fewer biomarkers) performed comparably to other predictive algorithms (such as MFNNs and logistic regression) to derive the perplexing relationship between biomarkers and the status of antidepressant treatments	166	171	ANALYTICAL_METHOD
Our data revealed that the ensemble predictive algorithm with feature selection (using fewer biomarkers) performed comparably to other predictive algorithms (such as MFNNs and logistic regression) to derive the perplexing relationship between biomarkers and the status of antidepressant treatments	176	196	ANALYTICAL_METHOD
The association between genotypes, alleles and blood pressure response to treatment was determined by conducting multivariate logistic regression model analysis	113	145	ANALYTICAL_METHOD
<b>Methods:</b> We genotyped thirteen tagging and functional SNPs of <i>ABCG2</i> in 1004 patients, and assessed their association with response, toxicity and survival using unconditional logistic regression and Cox proportional hazards regression analyses respectively	188	207	ANALYTICAL_METHOD
<b>Methods:</b> We genotyped thirteen tagging and functional SNPs of <i>ABCG2</i> in 1004 patients, and assessed their association with response, toxicity and survival using unconditional logistic regression and Cox proportional hazards regression analyses respectively	212	247	ANALYTICAL_METHOD
In simulation data with added noises or CFs and in pharmacogenomic data, RePhine demonstrated an improved performance in comparison with three commonly used methods (including Pearson correlation analysis, logistic regression model, and gene set enrichment analysis)	176	195	ANALYTICAL_METHOD
In simulation data with added noises or CFs and in pharmacogenomic data, RePhine demonstrated an improved performance in comparison with three commonly used methods (including Pearson correlation analysis, logistic regression model, and gene set enrichment analysis)	206	225	ANALYTICAL_METHOD
We genotyped 16 polymorphisms in genes for enzymes involved in the folate-methionine pathway and in methotrexate transport, and analysed their association with treatment efficacy and toxicity using classification and regression tree analysis and logistic regression	246	265	ANALYTICAL_METHOD
We constructed the predictive model using logistic regression	42	61	ANALYTICAL_METHOD
Multiple logistic regression was then performed to identify the factors associated with rapid CKD progression	0	28	ANALYTICAL_METHOD
Logistic regression models were used to examine the relationship between chronic pain and clinical and demographic factors	0	19	ANALYTICAL_METHOD
Five variables (hematocrit, risk classification, dose, SLC19A1 rs2838958, sex) and three variables (SLC19A1 rs2838958, sex, dose) were statistically significant in univariable analysis and, separately, multivariate logistic regression	164	184	ANALYTICAL_METHOD
Five variables (hematocrit, risk classification, dose, SLC19A1 rs2838958, sex) and three variables (SLC19A1 rs2838958, sex, dose) were statistically significant in univariable analysis and, separately, multivariate logistic regression	203	235	ANALYTICAL_METHOD
Logistic regressions were performed between PRSs and non-response or non-remission in six European clinical samples, adjusting for age, sex, baseline symptom severity, recruitment sites, and population stratification	0	20	ANALYTICAL_METHOD
Multivariable logistic regression analyzed the association between one or more gene-x-drug interactions with 90-day readmission	0	33	ANALYTICAL_METHOD
Responses were assessed using multivariable logistic regression	30	63	ANALYTICAL_METHOD
Logistic regression was used for analysis	0	19	ANALYTICAL_METHOD
Multivariable logistic regression analysis was employed to investigate the independent risk factors for bleeding and to develop a risk scoring system	0	33	ANALYTICAL_METHOD
Employing a logistic regression model with false discovery rate penalization and Kaplan-Meier analyses, we observed significant association between survival rates and metabolizer genes	12	31	ANALYTICAL_METHOD
Employing a logistic regression model with false discovery rate penalization and Kaplan-Meier analyses, we observed significant association between survival rates and metabolizer genes	81	102	ANALYTICAL_METHOD
Logistic regression model was used to analyze the correlation between the <i>CYP2D6</i> phenotype and incidence of adverse events, which were assessed over a 12-week period	0	19	ANALYTICAL_METHOD
In logistic regression model, the overall incidence of adverse events was 1	3	22	ANALYTICAL_METHOD
Race, income, employment status, and gene-x-drug interactions were robust in a multivariable logistic regression model	79	112	ANALYTICAL_METHOD
Two logistic regression models accounted for two diplotypes in OCT1 and ABCB1, including statistically significant covariates	4	23	ANALYTICAL_METHOD
Our multinomial logistic regression results may benefit future predictive analyses in diabetic populations	4	36	ANALYTICAL_METHOD
Univariate logistic regression demonstrated body mass index (BMI), concomitant use of protease inhibitor (PI), hyperlipidemia, and homozygous C/C SNP rs1059751 of <i>ABCC4</i> gene as predisposing factors of RTD	0	30	ANALYTICAL_METHOD
Genotypes and failure of anti-TNF drugs were analyzed using Kaplan-Meier curves and Cox logistic regression	60	79	ANALYTICAL_METHOD
Genotypes and failure of anti-TNF drugs were analyzed using Kaplan-Meier curves and Cox logistic regression	84	107	ANALYTICAL_METHOD
Multiple logistic regression analysis identified DRD2 -141C deletion [odds ratio (OR)\u2005=\u20051	0	28	ANALYTICAL_METHOD
Negative binomial regression and logistic regression were used	0	28	ANALYTICAL_METHOD
Negative binomial regression and logistic regression were used	33	52	ANALYTICAL_METHOD
Race, income, employment status, and gene-x-drug interactions were robust in a multivariable logistic regression model	79	112	ANALYTICAL_METHOD
Logistic regression models were fitted to assess the impact of activity scores on symptom improvement and side effects	0	19	ANALYTICAL_METHOD
We conducted logistic regression models to examine the association of genetic variants with CAA/L during acute KD and with persistence >6 weeks using an additive model between cases and 238 controls with no CAA	13	32	ANALYTICAL_METHOD
Genetic association analyses were conducted using the additive model and multivariable logistic regression	0	19	ANALYTICAL_METHOD
Genetic association analyses were conducted using the additive model and multivariable logistic regression	54	68	ANALYTICAL_METHOD
Genetic association analyses were conducted using the additive model and multivariable logistic regression	73	106	ANALYTICAL_METHOD
The Japonica array provides better imputation performance for Japanese individuals than the existing commercially available SNP arrays with both the 1KJPN panel and the International 1000 genomes project panel	183	205	ANALYTICAL_METHOD
To make concrete the goal of personalized medicine, it is necessary to employ high-throughput methodologies such as Next Generation Sequencing (NGS), Genome-Wide Association Studies (GWAS), Mass Spectrometry or Microarrays, that are able to investigate a single disease from a broader perspective	151	182	ANALYTICAL_METHOD
To make concrete the goal of personalized medicine, it is necessary to employ high-throughput methodologies such as Next Generation Sequencing (NGS), Genome-Wide Association Studies (GWAS), Mass Spectrometry or Microarrays, that are able to investigate a single disease from a broader perspective	190	207	ANALYTICAL_METHOD
Next generation sequencing (NGS) is a cost-effective option for genotyping patients at many pharmacogenomic loci simultaneously, and guidelines for implementation of these data are available from organizations such as the Clinical Pharmacogenetics Implementation Consortium (CPIC) and the Dutch Pharmacogenetics Working Group (DPWG)	222	273	ANALYTICAL_METHOD
Next generation sequencing (NGS) is a cost-effective option for genotyping patients at many pharmacogenomic loci simultaneously, and guidelines for implementation of these data are available from organizations such as the Clinical Pharmacogenetics Implementation Consortium (CPIC) and the Dutch Pharmacogenetics Working Group (DPWG)	289	325	ANALYTICAL_METHOD
It can be replaced by or combined with more advanced methods such as machine learning or natural language processing approaches to further improve the performance of the drug-gene relationship extraction from free text	69	85	ANALYTICAL_METHOD
It can be replaced by or combined with more advanced methods such as machine learning or natural language processing approaches to further improve the performance of the drug-gene relationship extraction from free text	89	127	ANALYTICAL_METHOD
In this literature-based study, we compared the performances of eight machine learning techniques with those of MLR in a large, racially-diverse cohort	70	86	ANALYTICAL_METHOD
We initiate the study of privacy in pharmacogenetics, wherein machine learning models are used to guide medical treatments based on a patient's genotype and background	62	78	ANALYTICAL_METHOD
Very recently, machine learning regression has been used to investigate how well cancer cell line sensitivity to drugs is predicted depending on the type of molecular profile	15	42	ANALYTICAL_METHOD
R code to facilitate the construction of alternative machine learning models and their validation in the presented benchmark is available at http://ballester	53	69	ANALYTICAL_METHOD
With machine learning and integrated pharmacogenomics and metabolomics, we demonstrate that KA efficacy is not determined by the status of individual genes, but by the quantitative extent of the WE, leading to a therapeutic window in\u00a0vivo	5	21	ANALYTICAL_METHOD
Machine learning models showed that independent SNPs in this pathway predicted TRD with a mean sensitivity of 0	0	16	ANALYTICAL_METHOD
Deep learning encapsulates a family of machine learning algorithms that has transformed many important subfields of artificial intelligence over the last decade, and has demonstrated breakthrough performance improvements on a wide range of tasks in biomedicine	0	14	ANALYTICAL_METHOD
Deep learning encapsulates a family of machine learning algorithms that has transformed many important subfields of artificial intelligence over the last decade, and has demonstrated breakthrough performance improvements on a wide range of tasks in biomedicine	39	55	ANALYTICAL_METHOD
Due to the limited resources, high costs, long duration, and low hit-to-lead ratio in the development of pharmacogenetics and computer technology, machine learning techniques have assisted novel drug development and have gradually received more attention by researchers	147	163	ANALYTICAL_METHOD
Among the identified small set of genes associated with reduced breast cancer incidence, laboratory experiments on one of the genes, CDC42, showed that its downregulation by metformin inhibited cancer cell migration and proliferation, thus validating the ability of machine learning approaches to identify biologically relevant candidates for laboratory experiments	266	282	ANALYTICAL_METHOD
During the last decade, the interest to apply machine learning algorithms to genomic data has increased in many bioinformatics applications	46	62	ANALYTICAL_METHOD
