CD36 is a cell surface glycoprotein composed of a single polypeptide chain, which interacts with thrombospondin, collagens type I and IV, oxidized low density lipoprotein, fatty acids, anionic phospholipids, and erythrocytes parasitized with Plasmodium falciparum.	23	35	GENE_OR_GENE_PRODUCT
CD36 is a cell surface glycoprotein composed of a single polypeptide chain, which interacts with thrombospondin, collagens type I and IV, oxidized low density lipoprotein, fatty acids, anionic phospholipids, and erythrocytes parasitized with Plasmodium falciparum.	97	111	GENE_OR_GENE_PRODUCT
CTLA-4 engagement by mAbs inhibits, while CD28 enhances, IL-2 production and proliferation upon T cell activation.	0	6	GENE_OR_GENE_PRODUCT
CTLA-4 engagement by mAbs inhibits, while CD28 enhances, IL-2 production and proliferation upon T cell activation.	42	46	GENE_OR_GENE_PRODUCT
CTLA-4 engagement by mAbs inhibits, while CD28 enhances, IL-2 production and proliferation upon T cell activation.	57	61	GENE_OR_GENE_PRODUCT
The transcription factor HIV-TF1, which binds to a region about 60 bp upstream from the enhancer of the human immunodeficiency virus-1 (HIV-1), was purified from human B cells.	25	32	GENE_OR_GENE_PRODUCT
In the examination of the induction of autoimmunity in transgenic mice, evidence has been obtained further implicating the lymphokine interferon-gamma in the etiology of autoimmunity.	134	150	GENE_OR_GENE_PRODUCT
IL-12 is a critical immunoregulatory cytokine that promotes cell-mediated immune responses and the differentiation of naive CD4+ cells to Th1 cells; however, relatively few IL-12 target genes have been identified.	0	5	GENE_OR_GENE_PRODUCT
Tat is an essential regulatory protein for the replication of human immunodeficiency virus (HIV).	0	3	GENE_OR_GENE_PRODUCT
Although much is understood about the induction of genes expressed early (within 24 h) after T-cell activation, little is known about the regulation of expression of genes expressed 'late' (three or more days) post-stimulation.	51	55	GENE_OR_GENE_PRODUCT
TRAF2 is a signal transducing adaptor molecule which binds to the CD40 cytoplasmic domain.	0	5	GENE_OR_GENE_PRODUCT
Activation of CD40 is essential for thymus-dependent humoral immune responses and rescuing B cells from apoptosis.	14	18	GENE_OR_GENE_PRODUCT
Few known genes (IL-2, members of the IL-8 family, interferon-gamma) are induced in T cells only through the combined effect of phorbol myristic acetate (PMA) and a Ca(2+)-ionophore, and expression of only these genes can be fully suppressed by Cyclosporin A (CyA).	10	14	GENE_OR_GENE_PRODUCT
Few known genes (IL-2, members of the IL-8 family, interferon-gamma) are induced in T cells only through the combined effect of phorbol myristic acetate (PMA) and a Ca(2+)-ionophore, and expression of only these genes can be fully suppressed by Cyclosporin A (CyA).	17	21	GENE_OR_GENE_PRODUCT
"Application of a ""formamide free"" and thus ""material preserving"" in situ hybridization technique using the cDNA of the myf3 gene revealed the following results: Human rhabdomyosarcoma cells, characterized by a high expression of myf3 show intensive hybridization signals in their interphase."	107	111	GENE_OR_GENE_PRODUCT
Activation through the Ca2+/calcineurin pathway is essential to the transcription of many cytokine genes.	28	39	GENE_OR_GENE_PRODUCT
The molecular mechanisms of the effects of IL-4 and IL-13 on HIV infection in human monocytes as they matured into monocyte-derived macrophages over 7 days were investigated using HIV-1(BaL), and low passage clinical strains.	43	47	GENE_OR_GENE_PRODUCT
The molecular mechanisms of the effects of IL-4 and IL-13 on HIV infection in human monocytes as they matured into monocyte-derived macrophages over 7 days were investigated using HIV-1(BaL), and low passage clinical strains.	52	57	GENE_OR_GENE_PRODUCT
AP-1, the polypeptide product of c-jun, recognizes and binds to specific DNA sequences and stimulates transcription of genes responsive to certain growth factors and phorbol esters such as 12-O-tetradecanoylphorbol-13-acetate (TPA).	0	4	GENE_OR_GENE_PRODUCT
AP-1, the polypeptide product of c-jun, recognizes and binds to specific DNA sequences and stimulates transcription of genes responsive to certain growth factors and phorbol esters such as 12-O-tetradecanoylphorbol-13-acetate (TPA).	33	38	GENE_OR_GENE_PRODUCT
AP-1, the polypeptide product of c-jun, recognizes and binds to specific DNA sequences and stimulates transcription of genes responsive to certain growth factors and phorbol esters such as 12-O-tetradecanoylphorbol-13-acetate (TPA).	119	123	GENE_OR_GENE_PRODUCT
Binding of type I interferon (IFN-alpha/beta) to specific receptors results in the rapid transcriptional activation, independent of protein synthesis, of IFN-alpha-stimulated genes (ISGs) in human fibroblasts and HeLa and Daudi cell lines.	30	44	GENE_OR_GENE_PRODUCT
The expression of the hematopoietic transcription factors GATA-1, GATA-2, and GATA-3 was studied in eosinophils and basophils.	58	64	GENE_OR_GENE_PRODUCT
The expression of the hematopoietic transcription factors GATA-1, GATA-2, and GATA-3 was studied in eosinophils and basophils.	66	72	GENE_OR_GENE_PRODUCT
The expression of the hematopoietic transcription factors GATA-1, GATA-2, and GATA-3 was studied in eosinophils and basophils.	78	84	GENE_OR_GENE_PRODUCT
The zinc finger transcription factor GATA-1 is a major regulator of gene expression in erythroid, megakaryocyte, and mast cell lineages.	37	43	GENE_OR_GENE_PRODUCT
GATA-1 binds to WGATAR consensus motifs in the regulatory regions of virtually all erythroid cell-specific genes.	0	6	GENE_OR_GENE_PRODUCT
A group of coordinately induced protooncogenes, cytoskeletal, and extracellular matrix genes have been termed immediate early response genes, and their induction has been associated with growth factor-stimulated cell proliferation.	32	45	GENE_OR_GENE_PRODUCT
CD14, a monocyte/macrophage receptor for the complex of LPS and LPS binding protein, is a differentiation marker for the monocyte/macrophage lineage.	0	4	GENE_OR_GENE_PRODUCT
CD40 is an important signaling and activation Ag found on certain bone marrow-derived cells.	0	4	GENE_OR_GENE_PRODUCT
The IL-2 growth hormone is the major growth factor of activated T lymphocytes during a developing immune response.	4	8	GENE_OR_GENE_PRODUCT
This study evaluates (i) constitutive levels of oncogene and p53 transcripts in chronic phase CML patients and (ii) their modulations subsequent to in vivo therapy with rIFN-alpha 2c.	48	56	GENE_OR_GENE_PRODUCT
XPB is a subunit of the basal transcription factor TFIIH, which is also involved in nucleotide excision repair (NER) and potentially in cell cycle regulation.	0	3	GENE_OR_GENE_PRODUCT
XPB is a subunit of the basal transcription factor TFIIH, which is also involved in nucleotide excision repair (NER) and potentially in cell cycle regulation.	51	56	GENE_OR_GENE_PRODUCT
TSC2 is a gene on chromosome 16p13.3 associated with the autosomal dominant neurocutaneous disorder, tuberous sclerosis complex (TSC).	0	4	GENE_OR_GENE_PRODUCT
The renin-angiotensin system may contribute to the pathogenesis of atherosclerosis.	4	9	GENE_OR_GENE_PRODUCT
IL-4, a product of the T-helper 0 (Th0) and 2 (Th2) subset, was originally described as a B-cell stimulatory factor and has subsequently been found to suppress IL-1 alpha, IL-1 beta, IL-6, IL-8, and TNF-alpha gene expression in monocytes stimulated with LPS, and to upregulate IL-1 receptor antagonist (IL1-RA) gene expression.	0	4	GENE_OR_GENE_PRODUCT
Cell cycle progression initiated by interleukin-2 (IL-2) in T cells is critical for lymphoproliferation and an immune response.	36	49	GENE_OR_GENE_PRODUCT
Cell cycle progression initiated by interleukin-2 (IL-2) in T cells is critical for lymphoproliferation and an immune response.	51	55	GENE_OR_GENE_PRODUCT
Since GH stimulates the development and function of granulocytes, we investigated the expression of GH in granulocyte subsets.	6	8	GENE_OR_GENE_PRODUCT
Since GH stimulates the development and function of granulocytes, we investigated the expression of GH in granulocyte subsets.	6	8	GENE_OR_GENE_PRODUCT
Previous cotransfection experiments had demonstrated that ectopic expression of the lymphocyte-specific transcription factor Oct2 could efficiently activate a promoter containing an octamer motif.	125	129	GENE_OR_GENE_PRODUCT
BOB.1/OBF.1 is a transcriptional coactivator that is constitutively expressed in B cells and interacts with the Oct1 and Oct2 transcription factors.	0	11	GENE_OR_GENE_PRODUCT
G0S3 is a member of a set of putative G0/G1 switch regulatory genes (G0S genes) selected by screening cDNA libraries prepared from human blood mononuclear cells cultured for 2 hr with lectin and cycloheximide.	0	4	GENE_OR_GENE_PRODUCT
IL-12 is a 75-kDa heterodimeric cytokine composed of two covalently linked p35 and p40 chains.	0	5	GENE_OR_GENE_PRODUCT
The NF-kappaB family of transcription factors regulates the inducible expression of a variety of genes.	4	13	GENE_OR_GENE_PRODUCT
BACKGROUND: IL-5 controls development of eosinophilia and has been shown to be involved in the pathogenesis of allergic diseases.	12	16	GENE_OR_GENE_PRODUCT
In both atopic and nonatopic asthma, elevated IL-5 has been detected in peripheral blood and the airways.	46	50	GENE_OR_GENE_PRODUCT
IL-5 is produced mainly by activated T cells, and its expression is regulated at the transcriptional level.	0	4	GENE_OR_GENE_PRODUCT
Oct-2 is a transcription factor that binds specifically to octamer DNA motifs in the promoters of immunoglobulin and interleukin-2 genes.	0	5	GENE_OR_GENE_PRODUCT
In 1991, we demonstrated, using electrophoretic mobility shift assays, that 3 different factors (termed B1, B2 and B3) with affinity for the KB-enhancer target sequence were specifically detected in nuclear extracts from HIV1-infected monocytes and macrophages.	104	106	GENE_OR_GENE_PRODUCT
In 1991, we demonstrated, using electrophoretic mobility shift assays, that 3 different factors (termed B1, B2 and B3) with affinity for the KB-enhancer target sequence were specifically detected in nuclear extracts from HIV1-infected monocytes and macrophages.	108	110	GENE_OR_GENE_PRODUCT
In 1991, we demonstrated, using electrophoretic mobility shift assays, that 3 different factors (termed B1, B2 and B3) with affinity for the KB-enhancer target sequence were specifically detected in nuclear extracts from HIV1-infected monocytes and macrophages.	115	117	GENE_OR_GENE_PRODUCT
The proto-oncogene products c-Fos and c-Jun heterodimerize through their leucine zippers to form the AP-1 transcription factor.	28	33	GENE_OR_GENE_PRODUCT
The proto-oncogene products c-Fos and c-Jun heterodimerize through their leucine zippers to form the AP-1 transcription factor.	38	43	GENE_OR_GENE_PRODUCT
Trapoxin is a microbially derived cyclotetrapeptide that inhibits histone deacetylation in vivo and causes mammalian cells to arrest in the cell cycle.	66	73	GENE_OR_GENE_PRODUCT
Our investigations have focused on localizing cis-elements responsible for the down regulation of the adult beta-like globin genes (delta and beta) in immature, or primitive erythroid tissues.	46	57	GENE_OR_GENE_PRODUCT
The promoters and enhancers of cell type-specific genes are often conserved in evolution, and hence one might expect that a given enhancer has evolved to work best with its own promoter.	4	12	GENE_OR_GENE_PRODUCT
The promoters and enhancers of cell type-specific genes are often conserved in evolution, and hence one might expect that a given enhancer has evolved to work best with its own promoter.	18	26	GENE_OR_GENE_PRODUCT
The promoters and enhancers of cell type-specific genes are often conserved in evolution, and hence one might expect that a given enhancer has evolved to work best with its own promoter.	18	26	GENE_OR_GENE_PRODUCT
This study was designed to determine the potential cis-elements involved in transcriptional regulation of the mouse perforin gene.	51	62	GENE_OR_GENE_PRODUCT
In response to activation of the Wnt signaling pathway, beta-catenin accumulates in the nucleus, where it cooperates with LEF/TCF (for lymphoid enhancer factor and T-cell factor) transcription factors to activate gene expression.	56	68	GENE_OR_GENE_PRODUCT
The mechanisms by which beta-catenin undergoes this shift in location and participates in activation of gene transcription are unknown.	24	36	GENE_OR_GENE_PRODUCT
We demonstrate here that beta-catenin can be imported into the nucleus independently of LEF/TCF binding, and it may also be exported from nuclei.	25	37	GENE_OR_GENE_PRODUCT
We have introduced a small deletion within beta-catenin (Delta19) that disrupts binding to LEF-1, E-cadherin, and APC but not axin.	43	55	GENE_OR_GENE_PRODUCT
We have introduced a small deletion within beta-catenin (Delta19) that disrupts binding to LEF-1, E-cadherin, and APC but not axin.	57	64	GENE_OR_GENE_PRODUCT
We have introduced a small deletion within beta-catenin (Delta19) that disrupts binding to LEF-1, E-cadherin, and APC but not axin.	91	96	GENE_OR_GENE_PRODUCT
We have introduced a small deletion within beta-catenin (Delta19) that disrupts binding to LEF-1, E-cadherin, and APC but not axin.	98	108	GENE_OR_GENE_PRODUCT
We have introduced a small deletion within beta-catenin (Delta19) that disrupts binding to LEF-1, E-cadherin, and APC but not axin.	114	117	GENE_OR_GENE_PRODUCT
We have introduced a small deletion within beta-catenin (Delta19) that disrupts binding to LEF-1, E-cadherin, and APC but not axin.	126	130	GENE_OR_GENE_PRODUCT
Constitutive expression of IFN-alpha5 and IFN-beta was detected in different lymphoid cells including peripheral blood mononuclear cells from normal individuals following amplification of IFN mRNA by reverse transcriptase-polymerase chain reaction and direct sequencing of the amplified product.	27	37	GENE_OR_GENE_PRODUCT
Constitutive expression of IFN-alpha5 and IFN-beta was detected in different lymphoid cells including peripheral blood mononuclear cells from normal individuals following amplification of IFN mRNA by reverse transcriptase-polymerase chain reaction and direct sequencing of the amplified product.	42	50	GENE_OR_GENE_PRODUCT
The HIV-1 accessory gene product Vpr can influence viral pathogenesis by affecting viral replication as well as host cell transcription and proliferation.	33	36	GENE_OR_GENE_PRODUCT
We investigated the mechanisms by which proinflammatory mediator, thrombin, released during intravascular coagulation and tissue injury, induces ICAM-1 (CD54) expression in endothelial cells.	66	74	GENE_OR_GENE_PRODUCT
We investigated the mechanisms by which proinflammatory mediator, thrombin, released during intravascular coagulation and tissue injury, induces ICAM-1 (CD54) expression in endothelial cells.	145	151	GENE_OR_GENE_PRODUCT
We investigated the mechanisms by which proinflammatory mediator, thrombin, released during intravascular coagulation and tissue injury, induces ICAM-1 (CD54) expression in endothelial cells.	153	157	GENE_OR_GENE_PRODUCT
The POU transcription factors Oct-1 and Oct-2 regulate the activity of octamer-dependent promoters, including those that direct transcription from rearranged immunoglobulin genes.	30	35	GENE_OR_GENE_PRODUCT
The POU transcription factors Oct-1 and Oct-2 regulate the activity of octamer-dependent promoters, including those that direct transcription from rearranged immunoglobulin genes.	40	45	GENE_OR_GENE_PRODUCT
The transcription factor GATA-1 is essential for normal erythropoiesis.	25	31	GENE_OR_GENE_PRODUCT
GATA3, a member of the GATA family that is abundantly expressed in the T-lymphocyte lineage, is thought to participate in T-cell receptor gene activation through binding to enhancers.	0	5	GENE_OR_GENE_PRODUCT
CD30, a member of the tumor necrosis factor (TNF) receptor family, is expressed constitutively on the surface of the human T cell line ACH-2, which is chronically infected with human immunodeficiency virus type-1 (HIV)-1.	0	4	GENE_OR_GENE_PRODUCT
Even with a therapy as specific as anti-TNF antibody, it is not clear if the benefit is attributable to simple binding and clearance of TNF-alpha or to binding on the cell surface and subsequent deletion of the activated macrophage.	136	145	GENE_OR_GENE_PRODUCT
MZF-1 is a C2H2 zinc finger gene encoding a putative transcriptional regulator of myeloid differentiation.	0	5	GENE_OR_GENE_PRODUCT
NF-kB is a eukaryotic transcription regulatory factor.	0	5	GENE_OR_GENE_PRODUCT
We have cloned a group of cDNAs representing mRNAs that are rapidly induced following adherence of human monocytes.	26	30	GENE_OR_GENE_PRODUCT
The Th2-type cytokines, interleukin-4 (IL-4) and interleukin-13 (IL-13), induce expression of a distinct subset of genes in human monocytes, including FcepsilonRIIb (CD23), 15-lipoxygenase, IL-1 receptor antagonist (IL-1ra), and type I and type II IL-1 receptors (IL-1R).	24	37	GENE_OR_GENE_PRODUCT
The Th2-type cytokines, interleukin-4 (IL-4) and interleukin-13 (IL-13), induce expression of a distinct subset of genes in human monocytes, including FcepsilonRIIb (CD23), 15-lipoxygenase, IL-1 receptor antagonist (IL-1ra), and type I and type II IL-1 receptors (IL-1R).	39	43	GENE_OR_GENE_PRODUCT
The Th2-type cytokines, interleukin-4 (IL-4) and interleukin-13 (IL-13), induce expression of a distinct subset of genes in human monocytes, including FcepsilonRIIb (CD23), 15-lipoxygenase, IL-1 receptor antagonist (IL-1ra), and type I and type II IL-1 receptors (IL-1R).	49	63	GENE_OR_GENE_PRODUCT
The Th2-type cytokines, interleukin-4 (IL-4) and interleukin-13 (IL-13), induce expression of a distinct subset of genes in human monocytes, including FcepsilonRIIb (CD23), 15-lipoxygenase, IL-1 receptor antagonist (IL-1ra), and type I and type II IL-1 receptors (IL-1R).	65	70	GENE_OR_GENE_PRODUCT
According to current models the inhibitory capacity of I(kappa)B(alpha) would be mediated through the retention of Rel/NF-kappaB proteins in the cytosol.	55	71	GENE_OR_GENE_PRODUCT
However, I(kappa)B(alpha) has also been detected in the nucleus of cell lines and when overexpressed by transient transfection.	9	25	GENE_OR_GENE_PRODUCT
CD28 is an important costimulatory molecule in the activation of human T cells.	0	4	GENE_OR_GENE_PRODUCT
DNA-binding motif analysis of the microarray-retrieved deregulated genes in the promoter region revealed NF\u03baB as potential transcription factor involved in cryptotanshinone's mode of action	34	45	TECHNIQUE
Here, we describe a user-friendly web-based software package, named Drug-SNPing, which provides a platform for the integration of drug information (DrugBank and PharmGKB), protein-protein interactions (STRING), tagSNP selection (HapMap) and genotyping information (dbSNP, REBASE and SNP500Cancer)	68	79	NO_ENTITY
PharmGKB-based inputs include the following: (i) gene name (HUGO), (ii) drug name and (iii) disease-related keywords	0	8	NO_ENTITY
Positive-pressure mechanical ventilation supports gas exchange in patients with respiratory failure but is also responsible for significant lung injury.	140	144	ORGAN
Irrespective of the etiology, many kidney diseases result in inflammation and fibrosis of the tubulointerstitium, with the subsequent loss of renal function.	35	41	ORGAN
Coordination of the immune response to injury or disease in the brain is postulated to involve bi-directional discourse between the immune system and the central nervous system.	64	69	ORGAN
CD4+ macrophages in tissues such as lung, skin, and lymph nodes, promyelocytic cells in bone marrow, and peripheral blood monocytes serve as important targets and reservoirs for human immunodeficiency virus type 1 (HIV-1) replication.	36	40	ORGAN
CD4+ macrophages in tissues such as lung, skin, and lymph nodes, promyelocytic cells in bone marrow, and peripheral blood monocytes serve as important targets and reservoirs for human immunodeficiency virus type 1 (HIV-1) replication.	42	46	ORGAN
In both atopic and nonatopic asthma, elevated IL-5 has been detected in peripheral blood and the airways.	97	103	ORGAN
Positive-pressure mechanical ventilation supports gas exchange in patients with respiratory failure but is also responsible for significant lung injury.	66	73	ORGANISM
A family of transcriptional activators has recently been identified in chickens; these transcriptional activators recognize a common consensus motif (WGATAR) through a conserved C4 zinc finger DNA-binding domain.	71	78	ORGANISM
High-dose estrogen administration induces anemia in mammals.	52	58	ORGANISM
Using the coiled-coil region of Stat5b as the bait in a yeast two-hybrid screen, we identified the association of Nmi, a protein of unknown function previously reported as an N-Myc interactor.	56	61	ORGANISM
HTLV-1 infection causes an adult T cell leukemia in humans.	0	6	ORGANISM
HTLV-1 infection causes an adult T cell leukemia in humans.	52	57	ORGANISM
Molecular, biochemical and epidemiological evidence implicate HTLV-I as an etiologic agent of adult T cell leukemia (ATL).	62	68	ORGANISM
To determine whether oxidative stress dependent NF-kappaB activation is evident in patients with diabetic nephropathy we used an Electrophoretic Mobility Shift Assay based semiquantitative detection system which enabled us to determine NF-kappaB activation in ex vivo isolated peripheral blood mononuclear cells.	83	90	ORGANISM
HTLV-I is the etiologic agent of adult T-cell leukemia/lymphoma and is associated with tropical spastic paraparesis/HTLV-I-associated myelopathy.	0	6	ORGANISM
HTLV-I is the etiologic agent of adult T-cell leukemia/lymphoma and is associated with tropical spastic paraparesis/HTLV-I-associated myelopathy.	0	6	ORGANISM
Uncontrolled replication of a virus, which is harmful to the host is also disadvantageous to the virus.	30	35	ORGANISM
Most viruses cannot compete with the various immune mechanisms and become eliminated in the course of infection.	5	10	ORGANISM
A few viruses, like the Herpesviruses or the papillomaviruses, however, have developed a sophisticated strategy for persisting lifelong, usually asymptomatically in the host, hiding from the immune system and producing infectious progeny at the same time.	24	35	ORGANISM
A few viruses, like the Herpesviruses or the papillomaviruses, however, have developed a sophisticated strategy for persisting lifelong, usually asymptomatically in the host, hiding from the immune system and producing infectious progeny at the same time.	45	59	ORGANISM
Three molecular clones of HIV-1, derived from a single isolate (AL1), exhibited distinct replicative and cytopathic properties during propagation in a human T cell line.	26	31	ORGANISM
Three molecular clones of HIV-1, derived from a single isolate (AL1), exhibited distinct replicative and cytopathic properties during propagation in a human T cell line.	64	67	ORGANISM
The GATA factors are a family of transcriptional regulatory proteins in eukaryotes that share extensive homology in their DNA-binding domains.	72	81	ORGANISM
Because candidiasis and cryptococcosis are common in human immunodeficiency virus (HIV)-infected persons, the effect of Cryptococcus neoformans and Candida albicans on HIV expression in monocytic cells was examined.	8	19	ORGANISM
Because candidiasis and cryptococcosis are common in human immunodeficiency virus (HIV)-infected persons, the effect of Cryptococcus neoformans and Candida albicans on HIV expression in monocytic cells was examined.	24	38	ORGANISM
We introduce a new experimental system combining adenovirus-mediated gene transfer and fetal thymic organ culture (FTOC).	49	59	ORGANISM
The level of ongoing HIV-1 replication within an individual is critical to HIV-1 pathogenesis.	21	26	ORGANISM
The level of ongoing HIV-1 replication within an individual is critical to HIV-1 pathogenesis.	21	26	ORGANISM
Among host immune factors, the cytokine TNF-alpha has previously been shown to increase HIV-1 replication in various monocyte and T cell model systems.	88	93	ORGANISM
Numerous cellular and biochemical abnormalities in immune regulation have been described in patients with systemic lupus erythematosus (SLE), including surface Ag receptor-initiated signaling events and lymphokine production.	92	99	ORGANISM
We have demonstrated that native envelope glycoproteins of HIV-1, gp160 can induce activation of the transcription factor, NF-kappa B.	59	64	ORGANISM
We have demonstrated that native envelope glycoproteins of HIV-1, gp160 can induce activation of the transcription factor, NF-kappa B.	66	71	ORGANISM
Studies of these females show that the XIST locus on their tiny ring X chromosomes is either not present or not expressed.	17	23	ORGANISM
The generation of genomic diversity during the course of infection has the potential to affect all aspects of HIV-1 replication, including expression of the proviral genome.	110	115	ORGANISM
Permissiveness to replication of human immunodeficiency virus (HIV) differs in T lymphocytes and macrophages.	63	66	ORGANISM
Recent evidence indicates that the rate of progression of the HIV-1 disease is significantly reduced in thalassaemia major patients upon treatment with high doses of desferrioxamine (DFX).	62	67	ORGANISM
Recent evidence indicates that the rate of progression of the HIV-1 disease is significantly reduced in thalassaemia major patients upon treatment with high doses of desferrioxamine (DFX).	123	130	ORGANISM
J delta K cells were isolated as a chronically infected survivor cell line, following infection of Jurkat CD4+ T cells with dl-NF, a mutated strain of human immunodeficiency virus type 1 (HIV-1) containing a deletion of the long terminal repeat (LTR) NF-kappa B sites.	124	129	ORGANISM
The HIV-1 accessory gene product Vpr can influence viral pathogenesis by affecting viral replication as well as host cell transcription and proliferation.	4	9	ORGANISM
